section,order,question,option_a,option_b,option_c,option_d,correct_answer,passage,passage_group
listening,1,What does the man want to do?,Go to the library,Meet a friend,Attend a class,Buy some books,A,,
listening,2,What is the woman's problem?,She lost her keys,She missed the bus,She forgot her homework,She is feeling sick,B,,
structure,1,The students _____ their homework before the class started.,have finished,had finished,has finished,finishing,B,,
structure,2,Neither the teacher nor the students _____ ready for the exam.,was,were,is,are,B,,
reading,1,According to the passage what is the main idea?,"The importance of education","The history of technology","Environmental protection","Economic development",C,"Climate change is one of the most pressing issues of our time. Scientists around the world agree that human activities, particularly the burning of fossil fuels, are contributing to global warming. Environmental protection has become a priority for many nations as they seek to reduce carbon emissions and preserve natural habitats for future generations.",passage_1
reading,2,What does the author suggest about carbon emissions?,They should be increased,They have no effect,They should be reduced,They are beneficial,C,"Climate change is one of the most pressing issues of our time. Scientists around the world agree that human activities, particularly the burning of fossil fuels, are contributing to global warming. Environmental protection has become a priority for many nations as they seek to reduce carbon emissions and preserve natural habitats for future generations.",passage_1
